[
  {
    "id": 1,
    "company": "Apple Inc.",
    "symbol": "AAPL",
    "quarter": "Q1",
    "year": 2025,
    "call_date": "2025-01-10",
    "revenue": {
      "value": 50000000000,
      "currency": "USD",
      "change_percent": 5.2
    },
    "eps": {
      "value": 2.5,
      "change_percent": 3.1
    },
    "sentiment": "positive",
    "sentiment_score": 0.75,
    "article_id": 1,
    "key_highlights": [
      "Strong iPhone sales growth",
      "Services revenue up 12%",
      "Positive outlook for next quarter"
    ]
  },
  {
    "id": 2,
    "company": "Microsoft Corporation",
    "symbol": "MSFT",
    "quarter": "Q4",
    "year": 2024,
    "call_date": "2025-01-08",
    "revenue": {
      "value": 60000000000,
      "currency": "USD",
      "change_percent": 8.5
    },
    "eps": {
      "value": 3.0,
      "change_percent": 6.2
    },
    "sentiment": "positive",
    "sentiment_score": 0.82,
    "article_id": 2,
    "key_highlights": [
      "Azure cloud growth continues",
      "Office 365 subscriptions strong",
      "AI investments paying off"
    ]
  },
  {
    "id": 3,
    "company": "Amazon.com Inc.",
    "symbol": "AMZN",
    "quarter": "Q4",
    "year": 2024,
    "call_date": "2025-01-05",
    "revenue": {
      "value": 170000000000,
      "currency": "USD",
      "change_percent": 2.8
    },
    "eps": {
      "value": 1.5,
      "change_percent": -1.2
    },
    "sentiment": "neutral",
    "sentiment_score": 0.15,
    "article_id": null,
    "key_highlights": [
      "AWS growth slowing",
      "Retail margins improving",
      "Mixed outlook"
    ]
  },
  {
    "id": 4,
    "company": "Tesla Inc.",
    "symbol": "TSLA",
    "quarter": "Q4",
    "year": 2024,
    "call_date": "2025-01-03",
    "revenue": {
      "value": 25000000000,
      "currency": "USD",
      "change_percent": -3.5
    },
    "eps": {
      "value": 0.75,
      "change_percent": -8.1
    },
    "sentiment": "negative",
    "sentiment_score": -0.45,
    "article_id": null,
    "key_highlights": [
      "Delivery numbers below expectations",
      "Margin pressure from price cuts",
      "Cybertruck production ramping"
    ]
  },
  {
    "id": 5,
    "company": "Meta Platforms Inc.",
    "symbol": "META",
    "quarter": "Q4",
    "year": 2024,
    "call_date": "2025-01-01",
    "revenue": {
      "value": 40000000000,
      "currency": "USD",
      "change_percent": 12.3
    },
    "eps": {
      "value": 4.5,
      "change_percent": 15.8
    },
    "sentiment": "positive",
    "sentiment_score": 0.68,
    "article_id": 3,
    "key_highlights": [
      "Reels engagement strong",
      "VR investments continuing",
      "Ad revenue growth accelerating"
    ]
  }
]